tico;ppro;dpro;stat;desc;hist;autr;adrs;reg;dpt_lettre;commune;affe;wadrs;wcom;code_departement;ploc;dmaj;ref;insee;contact;sclx;coordonnees_ban
Clocher de tourmente d'Auriac;"Clocher de tourmente d'Auriac, au hameau d'Auriac (cad. domaine public communal ; non cadastré) : inscription par arrêté du 17 juillet 1992";1992/07/17 : inscrit MH;propriété de la commune;;"Les clochers dits ""de tourmente"" sont limités aux franges du Mont Lozère. Construits dans des hameaux dépourvus d'églises, ces ouvrages servaient à diverses occasions : angélus, glas, appel pour l'école communale, prévention contre les orages de grêle, signal sonore à l'attention des personnes égarées par le brouillard. Ils se limitent aujourd'hui au glas et aux incendies. Ces clochers s'apparentent au type du clocher-mur à baie unique à arc plein cintre et sont dressés sur une base rectangulaire amincie vers le haut. Certains sont munis d'une petite loge pour le sonneur, ménagée dans l'épaisseur de la base. Parfois dotés d'une petite niche où prend place la statue de la Vierge ou d'un saint, ils sont tous chargés d'une croix de fer ou en pierre. Ces ouvrages sont l'oeuvre du 19e siècle.";;Hameau d'Auriac;Occitanie;Lozère;Saint-Julien-du-Tournel;;Hameau d'Auriac;Saint-Julien-du-Tournel;48;Anciennement région de : Languedoc-Roussillon;2019-05-15;PA00103945;48027;mediatheque.patrimoine@culture.gouv.fr;19e s.;44.499786,3.684304
Dolmen dit Cava de l'Alarb;Dolmen dit Cava de l'Alarb (cad. CH 162) : classement par arrêté du 3 novembre 1958;1958/11/03 : classé MH;propriété privée;;;;;Occitanie;Pyrénées-Orientales;Argelès-sur-Mer;;;Argelès-sur-Mer;66;Anciennement région de : Languedoc-Roussillon;2019-04-03;PA00103956;66008;mediatheque.patrimoine@culture.gouv.fr;Néolithique;42.543258,3.026232
Eglise Saint-Vincent;Eglise Saint-Vincent (cad. B 1176) : classement par arrêté du 28 janvier 1960;1960/01/28 : classé MH;propriété de la commune;;La plus ancienne mention de l'église figure sur une donation de la fin du 10e siècle. Donnée à l'abbaye Saint-Martin du Canigou en 1035, elle lui appartint jusqu'à la Révolution. Reconstruite sans doute par ses soins, l'église fut à nouveau consacrée en 1053. Une dernière dédicace, conséquence d'importantes transformations, eut lieu en 1213. L'édifice se compose d'une nef longée d'un bas-côté sud. Le bas-côté communique avec la nef par des arcades inégales portées par deux colonnes et par un pilier cruciforme. Il est voûté d'un demi-berceau et se termine à l'est par une absidiole creusée dans un massif, plat vers l'extérieur. Cette nef voûtée en berceau brisé se termine par une abside en hémicycle. Son pignon ouest est couronné par un clocher-mur à deux arcades. La partie des maçonneries du mur nord (formée de moellons bruts posés en arrêtes de poisson) est sans doute un vestige de la construction du 10e siècle. La consécration de 1053 peut correspondre à la construction de la nef méridionale et au percement, dans le mur séparatif, d'arcades portées par des piliers cruciformes. L'ancienne nef et son bas-côté ont été primitivement couverts de charpentes apparentes posées sur les arcs doubleaux dont les dosserets apparaissent encore au-dessus des chapiteaux. Deux colonnes semblent avoir été subsistuées aux piliers cruciformes dont le soubassement est conservé (sans doute au 13e siècle). A la consécration de 1213 correspondent la construction de l'abside principale, le parement de la fenêtre de l'absidiole et le placage qui masque l'ancienne porte du pignon ouest, ainsi que le portail sud en marbre rose. Les voûtes datent vraisemblablement de la même campagne.;;;Occitanie;Pyrénées-Orientales;Eus;;;Eus;66;Anciennement région de : Languedoc-Roussillon;2019-04-03;PA00104025;66074;mediatheque.patrimoine@culture.gouv.fr;15e s.;42.63661,2.465412
Eglise Sainte-Marie;Eglise : classement par arrêté du 8 août 1922;1922/08/08 : classé MH;propriété de la commune;;Edifice du 12e siècle comprenant une nef avec abside en cul de four, recouvert d'une voûte en berceau ogive reposant sur les murs. Un clocher carré s'élève contre la façade nord. Il comporte plusieurs étages dont deux à baies géminées avec colonnettes et chapiteaux. Il se termine par une couverture de forme pyramidale en lauzes. C'est l'un des rares exemples subsistant de couronnements de clochers romans dans la région. Un portail cantonné de deux colonnettes et encadré d'une archivolte à billettes, donne accès à la nef du côté sud. Cette nef était, à l'origine, couverte en lauzes d'ardoise.;;;Occitanie;Pyrénées-Orientales;Montferrer;;;Montferrer;66;Anciennement région de : Languedoc-Roussillon;2019-04-03;PA00104050;66116;mediatheque.patrimoine@culture.gouv.fr;;42.438708,2.575403
Hôtel de Régis;Façades et toitures sur rue et sur cour, y compris l'escalier (cad. EY 481) : inscription par arrêté du 7 février 1975;1975/02/07 : inscrit MH;propriété privée;;En 1671, l'emplacement était occupé par une maison avec porche et jardin. D'après divers détails stylistiques, il ne semble pas que l'hôtel soit antérieur au début du 18e siècle. La façade présente, au rez-de-chaussée, un portail d'entrée surmonté par une corniche et abrité sous un épais fronton circulaire. Au centre se détache un motif décoratif. Tous les linteaux, cintrés, sont décorés de consoles. Au deuxième étage, elles sont ornées de canaux et de guirlandes. Au premier, elles sont plus importantes et diversement traitées (guirlandes, personnages).;;Chapître (rue du) 14;Occitanie;Gard;Nîmes;;14 rue du Chapître;Nîmes;30;Anciennement région de : Languedoc-Roussillon;2019-11-05;PA00103099;30189;mediatheque.patrimoine@culture.gouv.fr;18e s.;43.837604,4.360956
Maison;Balcon en fer forgé du premier étage (cad. L 50) : inscription par arrêté du 19 février 1964;1964/02/19 : inscrit MH;propriété privée;;"Un plan féodal du chapitre, dressé d'après le compoix de 1671, montre que les immeubles situés entre le boulevard Gambetta et la rue de la Ferrage étaient alors de très modeste importance. A cette époque, l'actuel n°28 était occupé par trois maisons. Un regroupement immobilier a abouti, probablement entre 1760 et 1780, à la construction d'un hôtel assez important, avec terrasse sur le boulevard, sortie arrière rue de la Ferrage et façade principale ornée d'un balcon. La terrasse longe le boulevard au-dessus d'une série de boutiques. Le mur principal de façade est construit en arrière de cette terrasse. Il comporte un rez-de-chaussée surélevé, de plain-pied avec la terrasse ; un premier étage percé de cinq fenêtres et un deuxième étage avec cinq fenêtres plus petites. Le premier étage comporte, au centre, une porte-fenêtre à balcon galbé. Cette ferronnerie comporte un petit médaillon central ovale, au monogramme encadré de volutes symétriques. De part et d'autre, de longues volutes partant du pied de l'axe central, vont enrouler leurs spirales symétriquement, en dessinant un grand motif unique couvrant l'ensemble du panneau. Ces volutes sont entretoisées, alternativement, par des cercles et des losanges. Les angles arrondis du balcon correspondent à de petits panneaux cintrés dont le remplage à volutes se développe dans un encadrement simple, de façon à donner au motif spiralé une ampleur aussi grande que possible, en rapport avec celle du panneau central. Le dallage du balcon présente les mêmes ondulations que la ferronnerie.";;Gambetta (boulevard) 28;Occitanie;Gard;Nîmes;;28 boulevard Gambetta;Nîmes;30;Anciennement région de : Languedoc-Roussillon;2019-05-15;PA00103134;30189;mediatheque.patrimoine@culture.gouv.fr;18e s.;43.840325,4.360036
Eglise Saint-Martin;Eglise (cad. J 276) : inscription par arrêté du 5 août 1963;1963/08/05 : inscrit MH;propriété de la commune;;Cette église du 12e siècle se trouve aujourd'hui isolée, le centre de peuplement s'étant déplacé vers la plaine. Elle était le siège d'un prieuré qui dépendait du diocèse d'Uzès. En 1472, lorsque l'église Saint-Jean d'Alais fut érigée en collégiale, Rousson fut uni à ce nouveau chapitre. Par la suite, le prieur, désigné par le chapitre d'Alais, présentait son vicaire à la collation de l'évêque d'Uzès. La date de construction des bâtiments du prieuré (1617) se place dans la période de prospérité des revenus du prieuré. L'examen de l'ensemble des constructions fait apparaître plusieurs campagnes de construction. Au 12e siècle, construction de la nef, de l'abside centrale et des deux absidioles qui terminent le transept. La couverture de la nef a entièrement été refaite vers le début du 17e siècle, sur des doubleaux postiches qui retombent, tantôt au droit des piliers, tantôt sur les reins des grandes arcades. A cette époque, la toiture a été surélevée et refaite en tuiles canal. Les deux chapelles qui ont été ajoutées au nord et au sud de la travée du fond, sont couvertes d'ogives d'apparence moderne. La salle basse qui relie le prieuré au fond de la nef est une construction moderne. La sacristie est une adjonction du 19e siècle.;;;Occitanie;Gard;Rousson;;;Rousson;30;Anciennement région de : Languedoc-Roussillon;2019-05-15;PA00103189;30223;mediatheque.patrimoine@culture.gouv.fr;"12e s.;17e s.";44.193053,4.157092
Grotte préhistoriques de Labaume-Latrone;Grotte préhistoriques de Labaume-Latrone : classement par arrêté du 19 mai 1941;1941/05/19 : classé MH;propriété de la commune;;;;;Occitanie;Gard;Sainte-Anastasie;;;Sainte-Anastasie;30;Anciennement région de : Languedoc-Roussillon;2019-05-15;PA00103191;30228;mediatheque.patrimoine@culture.gouv.fr;"Age du bronze;Chalcolithique;Néolithique;Préhistoire";43.941811,4.332819
Domaine de Plantery;Fontaine (cad. B 652, 659) : inscription par arrêté du 5 août 1963;1963/08/05 : inscrit MH;propriété privée;;;;;Occitanie;Gard;Uzès;;;Uzès;30;Anciennement région de : Languedoc-Roussillon;2019-11-05;PA00103253;30334;mediatheque.patrimoine@culture.gouv.fr;18e s.;44.021039,4.415657
Maison;L'entrée, le sol de la cour et la tourelle d'escalier (cad. H 1625, 1623) : inscription par arrêté du 10 mars 1965;1965/03/10 : inscrit MH;propriété privée;;Plusieurs immeubles de cet îlot appartenaient au chapitre cathedral d'Agde pour être attribués comme résidences aux principaux bénéficiers. Tel est le cas de cet immeuble. La partie ancienne est limitée aux six mètres de façade au nord-ouest. La tour d'escalier se dresse à l'angle oriental de la cour qui a conservé son dallage ancien. La tourelle, qui déborde sur la cour par un quart de cercle, a ses autres parois intérieures rectangulaires. Elle contient une vis à noyau plein qui s'élève sur quatre étages au-dessus du rez-de-chaussée. Toute la construction est en lave basaltique noire. De même que la porte d'entrée de la tourelle dont l'encadrement, malgré la nature difficile de ce matériau, a été décoré de sculptures compliquées.;;Michelet (rue) 5;Occitanie;Hérault;Agde;;5 rue Michelet;Agde;34;Anciennement région de : Languedoc-Roussillon;2019-05-15;PA00103347;34003;mediatheque.patrimoine@culture.gouv.fr;17e s.;43.313401,3.469764
Ruines du moulin sur l'Hérault;Moulin sur l'Hérault (ruines) : inscription par arrêté du 15 septembre 1954;1954/09/15 : inscrit MH;propriété privée;;Une lettre particulière du pape Grégoire X à l'évêque Pierre Bérenger de Montbrun (13e siècle), félicite ce dernier de la construction des quatre moulins sur l'Hérault, établis à Agde, Bessan, Florensac et Saint-Thibéry. La construction du moulin se situe donc entre les années 1271 et 1276. Le bâtiment qui rejoint les deux constructions à éperons ne date que du 19e siècle. Le bâtiment au nord-ouest présente un plan rectangulaire prolongé vers l'amont par un triangle de quatre mètres de hauteur. La partie rectangulaire est divisée en deux parties par un grand arc brisé dont l'extrados supporte un muraillement appareillé. Le plancher disparu du premier étage reposait sur ce mur et cet arc, sur un autre mur également établi sur arc brisé, à la racine de l'éperon, et latéralement sur de puissants bandeaux en quart-de-rond. Au-dessous de ces bandeaux latéraux règnent deux arcs longitudinaux dans chacune des parois. Tous ces arcs sont brisés. Un deuxième étage est appuyé, d'une part, sur un grand arc brisé établi au-dessus du premier et, d'autre part, sur un encorbellement continu en quart-de-rond. Cet encorbellement sert également à la circulation et forme un véritable chemin de ronde qui dessert à la fois les bretèches latérales du mur de fond et les archères pratiquées dans les flancs. Un petit escalier en vis est logé contre la pointe de l'éperon. L'unique porte d'entrée est en arc brisé. De chaque côté de la porte, à une assise au-dessus du sommet de l'extrados, des corbeaux supportent une bretèche en arc brisé. A un niveau plus élevé, les côtés de cette bretèche reçoivent les retombées de deux arcs brisés. Les larges mâchicoulis ménagés en arrière de ces deux arcs brisés permettaient de défendre les approches de la porte centrale. Le deuxième bâtiment est d'apparence semblable au premier tout en présentant quelques différences dans les mensurations et dans la structure, laissant présumer que sa construction n'appartient pas à la même campagne. Il semble que l'aménagement intérieur n'ait pas été aussi poussé. La porte d'entrée est en arc brisé. Les bretèches ont disparu. A une époque plus récente, l'éperon a été surmonté d'une construction encorbelée (salle de guet) que les longues archères permettent d'attribuer au 14e siècle. La partie supérieure est visiblement moderne.;;;Occitanie;Hérault;Bessan;;;Bessan;34;Anciennement région de : Languedoc-Roussillon;2019-05-15;PA00103372;34031;mediatheque.patrimoine@culture.gouv.fr;"13e s.;19e s.";43.359201,3.416119
Maison Balat;Cheminée en pierre, au premier étage (cad. K 208) : inscription par arrêté du 24 décembre 1957;1957/12/24 : inscrit MH;propriété privée;;L'ensemble formé par les immeubles dits Baïsse et Balat paraît n'avoir formé qu'une seule construction autrefois. Les étages sont dans le même alignement, les plafonds sont semblables et les cheminées à peu près de la même époque. Il s'agissait là sans doute de la résidence d'un préposé de l'archevêque de Narbonne, seigneur de Capestang, peut-être son viguier temporel, très probablement un dignitaire du chapitre collégial. Les plafonds de Balat, contrairement à ceux de Baïsse, ne conservent pas de peintures décoratives d'origine. La cheminée, pour sa part, présente une décoration flamboyante. Les jambages sont ornés de trois séries de colonnettes à moulurations en cavet, et bases à moulurations entrecroisées. Le centre de la hotte est occupé par un motif flamboyant, très fouillé, composé d'arcatures et d'un enchevêtrement de soufflets et de mouchettes. Au centre se trouve un écu sans décor. Au-dessus, les vestiges mutilés de têtes d'anges ailés.;;;Occitanie;Hérault;Capestang;;;Capestang;34;Anciennement région de : Languedoc-Roussillon;2019-05-15;PA00103406;34052;mediatheque.patrimoine@culture.gouv.fr;"15e s.;16e s.";43.318087,3.055279
Croix de cimetière;Croix de cimetière, en marbre, de la fin du 15e siècle, dans le cimetière désaffecté cad. AB 208) : classement par arrêté du 8 juillet 1912;1912/07/08 : classé MH;propriété de la commune;;Croix cimetériale en marbre de la fin du 15e siècle. Un socle en maçonnerie est surmonté d'un bloc de granit dans lequel a été fixé un pilier octogonal en granit. Ce dernier est surmonté de la croix de forme octogonale. La tête et les deux bras se terminent en pointe de diamant encadrée dans quatre feuilles en volutes. Sur une face, représentation de la Crucifixion surmontée de l'inscription INRI. A la droite du Christ, la Vierge est représentée mains jointes et, à gauche, se trouve saint Jean drapé à la romaine. Sur l'autre face, Vierge à l'Enfant. A sa gauche se trouve le donateur tenant de sa main droite une palme qu'il semble offrir à la Vierge.;;dans le cimetière désaffecté;Occitanie;Hérault;Cébazan;;Dans le cimetière désaffecté;Cébazan;34;Anciennement région de : Languedoc-Roussillon;2019-05-15;PA00103424;34070;mediatheque.patrimoine@culture.gouv.fr;15e s.;
Eglise Saint-Pierre;Façade occidentale (cad. A 753) : inscription par arrêté du 12 juillet 1963;1963/07/12 : inscrit MH;propriété de la commune;;"Une église Saint-Pierre, située à l'emplacement du cimetière, est mentionnée dès 1096. Elle fut remplacée par un nouvel édifice en 1397, ruiné en 1573 par les Religionnaires. Une fois les troubles apaisés, les consuls décidèrent de la restaurer mais, constatant son insuffisance, ils entreprirent en 1603 la construction d'une nouvelle église au centre de la ville, à l'emplacement dit ""la Camarerie"". L'édifice ne fut achevé qu'en 1677. Dans cet état ancien, l'église présentait une tour-clocher très élevée, bâtie à gauche de l'entrée, et surmontée d'une flèche élevée. Le 7 décembre 1738, ce clocher s'effondra, entraînant la voûte avec lui et provoquant la mort de 97 victimes. Sa reconstruction fut aussitôt décidée, mais à un autre emplacement, à droite de l'entrée. Le mur de façade fut également entièrement reconstruit. Cette façade est d'ordonnance très simple : une porte axiale en plein cintre est encadrée de pilastres et surmontée, au premier étage, par une grande baie à arc surbaissé. Deux chaînes à refends marquent l'emplacement des murs longitudinaux de la nef. Le tout est couronné par un grand fronton triangulaire. Ces travaux durèrent de 1740 à 1745, et furent confiés à l'architecte Estienne Giral. L'édifice est à une nef, encadrée de chapelles latérales et se terminant par un chevet polygonal. La porte d'entrée située dans le mur du fond, est suivie d'un porche intérieur sur piliers qui sert de support à la tribune du fond.";Giral Etienne (maître de l'oeuvre);;Occitanie;Hérault;Gignac;;;Gignac;34;Anciennement région de : Languedoc-Roussillon;2019-11-05;PA00103461;34114;mediatheque.patrimoine@culture.gouv.fr;18e s.;43.654707,3.552958
Domaine du château;Ensemble du château, avec ses bâtiments annexes et ses jardins (cad. B 273, 274) : classement par arrêté du 20 octobre 1995;1995/10/20 : classé MH;propriété de la commune;;Un château féodal devait exister vraisemblablement dès le 11e siècle. Du premier château édifié en 1305 par Guillaume de Nogaret ne subsiste que le donjon carré avec sa tourelle. Construction du château Renaissance dans la seconde moitié du 16e siècle (aile Renaissance sur cour). Aile imitation Renaissance réalisée dans la deuxième moitié du 17e siècle. Orangerie, portail d'entrée, cour d'honneur et jardin du 18e siècle.;;;Occitanie;Hérault;Marsillargues;;;Marsillargues;34;Anciennement région de : Languedoc-Roussillon;2019-11-05;PA00103500;34151;mediatheque.patrimoine@culture.gouv.fr;"14e s.;16e s.;17e s.;18e s.";43.633934,4.136522
Tour;Tour (cad. E 281) : inscription par arrêté du 21 mars 1960;1960/03/21 : inscrit MH;propriété privée;;"Isolée de toutes parts, cette tour carrée représenterait le seul vestige de l'ancien château de Montady. Mais aucune amorce de mur ne permet de la relier à de possibles autres éléments, ce qui permet plutôt d'admettre qu'elle était également isolée autrefois et se trouvait être un ouvrage isolé de l'ancien ""castrum"". Le castrum de Montadino est mentionné à partir de 1097 ; celui de Montaditi en 1134. Cette seigneurie dépendait alors, en partie, du seigneur de Capestang. La noble famille de Séguier, de Narbonne, posséda la moitié de cette seigneurie du 12e au 14e siècle. En 1389, il y avait trois cosseigneurs. En 1643, Charles de Thézan, baron de Saint-Géniez, vendit sa part de la seigneurie au chapitre de Saint-Nazaire de Béziers. La tour se dresse au point culminant d'un promontoire rocheux, face à l'oppidum d'Ensérune. Elle s'élève de deux étages voûtés en berceau plein cintre. Il n'y a pas d'escaliers. L'accès se faisait par échelles grâce à des ouvertures ménagées dans les voûtes. La porte basse n'est pas ancienne. Le haut conserve les traces d'un ancien crénelage, souligné par une rangée de trous de boulins à la base des merlons. La partie supérieure a donc été reprise ultérieurement, de sorte que la tour est actuellement plus haute qu'à l'origine. Comme autres moyens défensifs, on trouve quelques archères.";;;Occitanie;Hérault;Montady;;;Montady;34;Anciennement région de : Languedoc-Roussillon;2019-05-15;PA00103511;34161;mediatheque.patrimoine@culture.gouv.fr;12e s.;43.335676,3.13151
Hôtel de l'Epine;"Façade avec cabochons et balcons en fer forgé ; porte en pierre : inscription par arrêté du 9 septembre 1933";1933/09/09 : inscrit MH;propriété privée;;;;Victor-Hugo (rue) 9;Occitanie;Hérault;Pézenas;;9 rue Victor-Hugo;Pézenas;34;Anciennement région de : Languedoc-Roussillon;2019-05-15;PA00103640;34199;mediatheque.patrimoine@culture.gouv.fr;"17e s.;18e s.";43.458788,3.424374
Eglise Saint-Laurent et Notre-Dame;Eglise : classement par liste de 1840;1840 : classé MH;propriété de la commune;;;;;Centre-Val de Loire;Indre;Gargilesse-Dampierre;;;Gargilesse-Dampierre;36;Anciennement commune de : Gargilesse. Anciennement région de : Centre;2019-10-16;PA00097352;36081;mediatheque.patrimoine@culture.gouv.fr;11e s.;46.508827,1.585089
Vestiges archéologiques situés sous et aux abords du musée archéologique d'Argentomagus;Vestiges archéologiques situés sous et aux abords du musée archéologique d'Argentomagus (cad. D 95, 101, 102, 2362, 1696) : inscription par arrêté du 5 avril 1990;1990/04/05 : inscrit MH;"propriété de l'Etat ; propriété de la commune";;;;;Centre-Val de Loire;Indre;Saint-Marcel;;;Saint-Marcel;36;Anciennement région de : Centre;2019-05-15;PA00097492;36200;mediatheque.patrimoine@culture.gouv.fr;;46.603344,1.512399
Maison du 16e siècle dite de Rabelais;Maison (cad. AS 1133) : inscription par arrêté du 28 mai 1926;1926/05/28 : inscrit MH;propriété privée;;Cette maison en pierre a été défigurée par sa transformation en magasin dans les années 1970, et restaurée depuis.;;"Rabelais (rue) 2 ; Lamproie (rue de la) 2";Centre-Val de Loire;Indre-et-Loire;Chinon;;"2 rue Rabelais ; 2 rue de la Lamproie";Chinon;37;Anciennement région de : Centre;2019-04-03;PA00097677;37072;mediatheque.patrimoine@culture.gouv.fr;16e s.;47.166024,0.241261
Maison du 16e siècle (ancienne maison du Bailli);Maison du 16s (ancienne maison du Bailli) : inscription par arrêté du 29 décembre 1927;1927/12/29 : inscrit MH;propriété privée;;;;"Georges-Clemenceau (place) ; anciennement Grand-Place";Centre-Val de Loire;Loir-et-Cher;Montoire-sur-le-Loir;;"place Georges-Clemenceau ; anciennement Grand-Place";Montoire-sur-le-Loir;41;Anciennement région de : Centre;2019-04-03;PA00098510;41149;mediatheque.patrimoine@culture.gouv.fr;16e s.;47.752833,0.861459
Voie gallo-romaine dite voie de Jules César ou chemin de Chartres (également sur communes de Verdes, Membrolles et La Colombe);Voie gallo-romaine dite voie de Jules César : classement par arrêté du 6 septembre 1978;1978/09/06 : classé MH;propriété de la commune;;;;;Centre-Val de Loire;Loir-et-Cher;Semerville;;;Semerville;41;Oeuvre située en partie sur les communes : Verdes, Membrolles, Colombe (La). Anciennement région de : Centre;2019-04-03;PA00098604;41244;mediatheque.patrimoine@culture.gouv.fr;Gallo-romain;47.935333,1.379358
Immeuble;Immeuble : inscription par arrêté du 31 octobre 1940;1940/10/31 : inscrit MH;propriété privée;;Maison certainement construite entièrement en bois, le premier étage étant en encorbellement. Le n°4 possède un second étage sans doute postérieur.;;Renarderie (rue de la) 4, 6;Centre-Val de Loire;Loir-et-Cher;Vendôme;;4, 6 rue de la Renarderie;Vendôme;41;Anciennement région de : Centre;2019-04-03;PA00098638;41269;mediatheque.patrimoine@culture.gouv.fr;"15e s.;16e s.";47.791021,1.066409
Château de Dunois, actuellement Musée de l'Orléanais;"Le château (à l'exclusion des parties classées) (cad. F4 1041) : inscription par arrêté du 16 juillet 1925 - Le pavillon carré du 16e siècle donnant sur la place de la Barrière ; la tourelle d'escalier hexagonale dans la cour avec les bâtiments en aile à gauche et à droite ; la petite tourelle circulaire contenant l'oratoire du Cardinal de Longueville ; l'ancienne chapelle dans l'aile droite (cad. F4 1041) : classement par arrêté du 18 août 1926";"1925/07/16 : inscrit MH ; 1926/08/18 : classé MH";propriété d'une société privée;;Château acheté par Jean Dunois, compagnon de Jeanne d'Arc, en 1422. Sur la place, pavillon carré du 16e siècle. Dans la cour, tourelle hexagonale d'escalier du 15e siècle et bâtiments en ailes de chaque côté. Petite tourelle circulaire sur la fae opposée à l'escalier, contenant l'oratoire du cardinal de Longueville, dit oratoire de Jeanne d'Arc. L'ancienne chapelle castrale est située dans l'aile de droite.;;Dunois (place);Centre-Val de Loire;Loiret;Beaugency;;place Dunois;Beaugency;45;Anciennement région de : Centre;2019-12-26;PA00098690;45028;mediatheque.patrimoine@culture.gouv.fr;"15e s.;16e s.";47.777525,1.633462
