tico;ppro;dpro;stat;desc;hist;autr;adrs;reg;dpt_lettre;commune;affe;wadrs;wcom;code_departement;ploc;dmaj;ref;insee;contact;sclx;coordonnees_ban
Eglise Notre-Dame;Eglise Notre-Dame (cad. F4 1042) : classement par liste de 1862;1862 : classé MH;propriété de la commune;;Ancienne abbatiale construite au 12e siècle et restaurée en 1642. Voûtes en bois du 17e siècle, achevées en 1684 et composées selon la disposition des croisées d'ogives, hormis le déambulatoire (voûtes d'arêtes) et les chapelles absidiales (cul de four). Au-dessus des archivoltes du rond-point s'ouvre un triforium. La chapelle Sainte-Anne a été rajoutée en 1874-76 sur les plans de l'architecte René Dusserre. Le vitrail est de Lobin.;Dusserre René (architecte);Dunois (place);Centre-Val de Loire;Loiret;Beaugency;;place Dunois;Beaugency;45;Anciennement région de : Centre;2019-12-13;PA00098691;45028;mediatheque.patrimoine@culture.gouv.fr;;47.777525,1.633462
Groupe d'habitations en pans de bois;Groupe d'habitations en pans de bois, au Sud-Est de l'église Saint-Michel : inscription par arrêté du 18 octobre 1941;1941/10/18 : inscrit MH;propriété privée;;;;Saint-Michel (rue) 15, 27, 29, 31, 124, 125;Centre-Val de Loire;Loiret;Ferté-Saint-Aubin (La);;15, 27, 29, 31, 124, 125 rue Saint-Michel;La Ferté-Saint-Aubin;45;Anciennement région de : Centre;2019-05-15;PA00098778;45146;mediatheque.patrimoine@culture.gouv.fr;;47.724891,1.941886
Maison du 15e siècle;Façade et toiture : inscription par arrêté du 22 août 1949;1949/08/22 : inscrit MH;propriété privée;;Maison construite sur la ceinture d'anciens remparts. Le deuxième étage est à pan de bois et torchis, à encorbellement. Toiture en tuiles plates.;;Bridolle (place de la);Nouvelle-Aquitaine;Corrèze;Beaulieu-sur-Dordogne;;place de la Bridolle;Beaulieu-sur-Dordogne;19;Anciennement région de : Limousin;2019-05-15;PA00099675;19019;mediatheque.patrimoine@culture.gouv.fr;"15e s.;18e s.";44.979384,1.837715
Porte aux armes de la ville;Porte aux armes de la ville : inscription par arrêté du 22 août 1949;1949/08/22 : inscrit MH;propriété privée;;Porte en ogive, moulurée, base gothique. Clé sculptée aux armes de la ville.;;;Nouvelle-Aquitaine;Corrèze;Beaulieu-sur-Dordogne;;;Beaulieu-sur-Dordogne;19;Anciennement région de : Limousin;2019-05-15;PA00099681;19019;mediatheque.patrimoine@culture.gouv.fr;14e s.;44.994872,1.829917
Immeuble dit Leygonie;"Façades et toitures ; escalier intérieur avec ses galeries ; deux cheminées au premier étage et deux au second étage. (cad. BL 83) : inscription par arrêté du 30 mars 1979";1979/03/30 : inscrit MH;propriété d'une société privée;;Immeuble caractéristique du 16e siècle, en particulier par sa façade aux baies moulurées, son escalier droit aux galeries superposées, ses cheminées aux jambages et à la hotte moulurés. Au bâtiment de plan trapézoïdal s'ajoute une construction rectangulaire accolée à la façade nord, abritant l'escalier.;;Petite-Place (rue de la) 13;Nouvelle-Aquitaine;Corrèze;Brive-la-Gaillarde;;13 rue de la Petite-Place;Brive-la-Gaillarde;19;Anciennement région de : Limousin;2019-05-15;PA00099693;19031;mediatheque.patrimoine@culture.gouv.fr;16e s.;45.159108,1.534175
Sanctuaire gallo-romain;Sanctuaire gallo-romain comportant notamment trois temples (cad. A 831) : classement par arrêté du 19 décembre 1984;1984/12/19 : classé MH;propriété privée;;;;;Nouvelle-Aquitaine;Corrèze;Margerides;;;Margerides;19;Anciennement région de : Limousin;2019-05-15;PA00099798;19128;mediatheque.patrimoine@culture.gouv.fr;Gallo-romain;45.459741,2.436486
Laiterie de Madame (ancienne);Laiterie de Madame (ancienne) : classement par arrêté du 1er août 1957;1957/08/01 : classé MH;propriété privée;;;;Paris (avenue de) 57;Île-de-France;Yvelines;Versailles;;57 avenue de Paris;Versailles;78;;2019-05-15;PA00087755;78646;mediatheque.patrimoine@culture.gouv.fr;;48.799412,2.142048
Hôtel particulier appelé maison La Colette ou hôtel de Schonen;La maison (cad. T 516) : inscription par arrêté du 16 juin 1965;1965/06/16 : inscrit MH;propriété privée;;;;Saint-Louis (rue) 20;Île-de-France;Yvelines;Versailles;;20 rue Saint-Louis;Versailles;78;;2019-11-05;PA00087761;78646;mediatheque.patrimoine@culture.gouv.fr;18e s.;48.795099,2.125344
Château de Grand'Maison;"Façades et toitures ; petit salon et grand salon bleu avec leur décor (cad. A 84) : inscription par arrêté du 9 juillet 1970";1970/07/09 : inscrit MH;propriété privée;;;LEROUX J.B. (maître de l'oeuvre);;Île-de-France;Yvelines;Villepreux;;;Villepreux;78;;2019-11-05;PA00087783;78674;mediatheque.patrimoine@culture.gouv.fr;"18e s.;19e s.";48.830157,2.011714
Domaine des Tourelles;"Façades et toitures de la maison de maître et des deux pavillons du domaine ; restes du portail sur rue entre les deux pavillons (cad. A 732, 735) : inscription par arrêté du 7 septembre 1977";1977/09/07 : inscrit MH;propriété privée;;;;Courtanesse (rue);Île-de-France;Essonne;Boissy-sous-Saint-Yon;;rue Courtanesse;Boissy-sous-Saint-Yon;91;;2019-11-05;PA00087821;91085;mediatheque.patrimoine@culture.gouv.fr;16e s.;48.559476,2.207305
Menhirs de la propriété Talma, dits la femme et la fille de Loth;Menhirs de la propriété Talma, dits la femme et la fille de Loth (cad. D 309, 311) : classement par liste de 1889;1889 : classé MH;propriété de la commune;;;;;Île-de-France;Essonne;Brunoy;;;Brunoy;91;;2019-05-15;PA00087837;91114;mediatheque.patrimoine@culture.gouv.fr;Néolithique;48.695621,2.506084
Eglise Saint-Etienne;Eglise : classement par arrêté du 25 mars 1930;1930/03/25 : classé MH;propriété de la commune;;Clocher roman de l'an 1100. Remaniement des voûtes des bas-côtés du choeur à la fin du 13e siècle. Entre le 17e et le 19e siècle, dégâts causés par les explosions de la poudrerie royale proche.;;;Île-de-France;Essonne;Corbeil-Essonnes;;;Corbeil-Essonnes;91;;2019-11-05;PA00087864;91174;mediatheque.patrimoine@culture.gouv.fr;;48.598165,2.462691
Eglise Saint-Gervais Saint-Protais;Clocher : inscription par arrêté du 6 juillet 1925;1925/07/06 : inscrit MH;propriété de la commune;;;;Saint-Gervais (rue);Île-de-France;Essonne;Courdimanche-sur-Essonne;;;Courdimanche-sur-Essonne;91;;2019-05-15;PA00087875;91184;mediatheque.patrimoine@culture.gouv.fr;"12e s.;18e s.";48.419442,2.361085
Hôtel-Dieu, actuellement centre hospitalier;"Portail sur la rue de la République ; façades et toitures des bâtiments sur la première et la deuxième cour (sauf constructions du 20s) ; chapelle et sacristie ; deux escaliers du 18s ; décors intérieurs des pièces suivantes de l'aile de la communauté : rez-de-chaussée : actuel bureau du directeur ; actuelle entrée avec son bureau contigü, ancienne chapelle ; premier étage : ancienne salle du chapître (cad. AN 402) : inscription par arrêté du 1er juin 1988";1988/06/01 : inscrit MH;propriété de la commune;;;;République (rue de la) 37;Île-de-France;Essonne;Etampes;;37 rue de la République;Etampes;91;;2019-11-05;PA00087897;91223;mediatheque.patrimoine@culture.gouv.fr;"17e s.;18e s.";48.433037,2.167421
Maison dite de Diane de Poitiers;"Maison : inscription par arrêté du 10 mai 1926 ; Porte Renaissance dans la cour intérieure (autrefois entrée de l'ancien musée) : inscription par arrêté du 19 mai 1939";"1926/05/10 : inscrit MH ; 1939/05/19 : inscrit MH";propriété privée;;;;Sainte-Croix (rue) 4;Île-de-France;Essonne;Etampes;;4 rue Sainte-Croix;Etampes;91;;2019-05-15;PA00087900;91223;mediatheque.patrimoine@culture.gouv.fr;;48.435658,2.161053
Croix-autel;Croix-autel : inscription par arrêté du 13 avril 1933;1933/04/13 : inscrit MH;propriété de la commune;;;;Grande-Rue ();Île-de-France;Essonne;Juvisy-sur-Orge;;Grande-Rue;Juvisy-sur-Orge;91;;2019-05-15;PA00087928;91326;mediatheque.patrimoine@culture.gouv.fr;18e s.;48.688977,2.376324
Eglise Sainte-Marie-Madeleine;Clocher et travée de bas-coté joignant le pignon au chevet : classement par arrêté du 13 septembre 1920;1920/09/13 : classé MH;propriété de la commune;;;;;Île-de-France;Essonne;Massy;;;Massy;91;;2019-11-05;PA00087949;91377;mediatheque.patrimoine@culture.gouv.fr;13e s.;48.728461,2.269556
Maison à tourelles;La façade sur rue et la toiture correspondante (cad. AI 572) : inscription par arrêté du 12 mars 1969;1969/03/12 : inscrit MH;propriété privée;;;;Lau (rue du) 11bis;Île-de-France;Essonne;Milly-la-Forêt;;11bis rue du Lau;Milly-la-Forêt;91;;2019-11-05;PA00087960;91405;mediatheque.patrimoine@culture.gouv.fr;;48.402381,2.465671
Eglise Notre-Dame;Eglise Notre-Dame : inscription par arrêté du 27 août 1953;1953/08/27 : inscrit MH;propriété de la commune;;;;;Île-de-France;Essonne;Sermaise;;;Sermaise;91;;2019-05-15;PA00088018;91593;mediatheque.patrimoine@culture.gouv.fr;;48.527078,2.086457
Eglise (ancienne);Vestiges : inscription par arrêté du 17 avril 1931;1931/04/17 : inscrit MH;propriété privée;;;;;Île-de-France;Essonne;Souzy-la-Briche;;;Souzy-la-Briche;91;;2019-11-05;PA00088020;91602;mediatheque.patrimoine@culture.gouv.fr;15e s.;48.528017,2.157188
Bornes n° 11 et 12 à bonnet phrygien;Bornes n° 11 et 12 à bonnet phrygien : inscription par arrêté du 22 mars 1934;1934/03/22 : inscrit MH;;;;;Sur la route de Corbeil à Versailles;Île-de-France;Essonne;Viry-Châtillon;;Sur la route de Corbeil à Versailles;Viry-Châtillon;91;;2019-05-15;PA00088044;91687;mediatheque.patrimoine@culture.gouv.fr;;48.676461,2.364997
Immeuble, actuellement institut Saint-Clément;Le nymphée, l'orangerie avec son mur de soutènement et son parterre (cad. AB 82) : classement par arrêté du 22 mars 1983;1983/03/22 : classé MH;propriété de la commune;;;;Maurice-Sabatier (rue) 21;Île-de-France;Essonne;Viry-Châtillon;;21 rue Maurice-Sabatier;Viry-Châtillon;91;;2019-11-05;PA00088046;91687;mediatheque.patrimoine@culture.gouv.fr;"17e s.;19e s.";48.670072,2.37511
Domaine de Baville (également sur commune de Saint-Chéron);Domaine de Baville (cad. A 1185) : inscription par arrêté du 22 octobre 1990;1990/10/22 : inscrit MH;propriété privée;;;;;Île-de-France;Essonne;Breux-Jouy;;;Breux-Jouy;91;Oeuvre sur plusieurs communes : SAINT CHERON;2019-05-15;PA00088054;91106;mediatheque.patrimoine@culture.gouv.fr;17e s.;48.554673,2.163653
Manufacture royale de cire (ancienne);Bas-relief représentant une ruche encastrée dans le mur : inscription par arrêté du 10 avril 1929;1929/04/10 : inscrit MH;propriété d'une association;;;;Bois-de-Verrières (avenue du) 14;Île-de-France;Hauts-de-Seine;Antony;;14 avenue du Bois-de-Verrières;Antony;92;;2019-05-15;PA00088060;92002;mediatheque.patrimoine@culture.gouv.fr;18e s.;48.755107,2.295101
